{
  "schema": "sauti.approval_record",
  "schema_version": "1.0.0",
  "approval_id": "11111111-2222-4333-8444-555555555555",
  "action_id": "42424242-1234-4abc-8123-abcdefabcdef",
  "digest": "1cfa0b8a1fa42b70ebb9ea3b172477307fba29e1de367c83f3be02535aa7b94f",
  "fact_revision": 1,
  "decision": "approved",
  "decided_at": "2026-10-03T20:10:00Z",
  "owner_context": {
    "owner_id": "demo-noor-001",
    "device_id": "demo-android-001",
    "unlock": "pin",
    "confirmation": "tap",
    "session_id": "local-session-0001",
    "authenticated_at": "2026-10-03T20:08:00Z"
  }
}
